Computer Science,https://www.aau.dk/uddannelser/bachelor/datalogi,det er bare super sejt,
Computer Technology,https://www.aau.dk/uddannelser/bachelor/computerteknologi,det er bare super nederen,
Data Science and ML,https://www.aau.dk/uddannelser/bachelor/datavidenskab-og-machine-learning,det er for nørder,
Information Technology,https://www.aau.dk/uddannelser/bachelor/informationsteknologi,det er Allans ynglings,
Interaction Design, https://www.aau.dk/uddannelser/bachelor/interaktionsdesign,hakkuna mattatta,
Software Engineering,https://www.aau.dk/uddannelser/bachelor/software,og julen varer li til påske,
Robotics,https://www.aau.dk/uddannelser/bachelor/robotteknologi,last christmas by wham,
Electronic and System Design,https://www.aau.dk/uddannelser/bachelor/elektronik-og-systemdesign,noget random tekst,
Design and application of AI, https://www.aau.dk/uddannelser/bachelor/design-og-anvendelse-af-kunstig-intelligens
Innovation and digitalisation, https://www.aau.dk/uddannelser/bachelor/innovation-digitalisering
Electronics Diploma engineer, https://www.aau.dk/uddannelser/bachelor/elektronik
Mathematics technology, https://www.aau.dk/uddannelser/bachelor/matematik-teknologi
Mediaology, https://www.aau.dk/uddannelser/bachelor/medialogi-aalborg
Health technology, https://www.aau.dk/uddannelser/bachelor/sundhedsteknologi